{
  "version": 1,
  "generatedFrom": "e98276d (atelier HEAD; clean unless noted)",
  "products": [
    {
      "id": "ark",
      "title": "Ark",
      "description": "A protected local library: knowledge, compute, power, configuration and restart materials that stay useful when the internet, the grid or ordinary infrastructure is not. Four tiers — Library, Librarian, Archivist, Athenaeum — in a mini case, a .30-cal, a .50-cal and a 20-cal, with an external Meshtastic communications sled.",
      "narration": "What in your house still works when the power goes out? These cases hold a library, a computer, and their own power, sealed and ready. The book you just saw talks to them by radio, so the knowledge sits here and travels to whoever needs it. Not for the end of the world. For the week a storm takes the grid down.",
      "priceDetail": "Library $299 · Librarian $529 · Archivist $999 · Athenaeum $1,999. Communications sled sold separately",
      "category": "devices",
      "maturity": "Seedling",
      "status": "development",
      "availability": "Draft product architecture",
      "checkoutProductId": null,
      "facultySponsor": null,
      "pageUrl": "https://ark.castalia.institute/",
      "offer": {
        "price": 299,
        "currency": "USD",
        "pricingNote": "$299–1,999",
        "notForSale": false
      },
      "variants": [
        {
          "title": "Library",
          "price": 299
        },
        {
          "title": "Librarian",
          "price": 529
        },
        {
          "title": "Archivist",
          "price": 999
        },
        {
          "title": "Athenaeum",
          "price": 1999
        }
      ],
      "tags": [
        "category:devices",
        "orchard:seedling"
      ]
    },
    {
      "id": "astrolabe",
      "title": "Astrolabe",
      "description": "A tactile, glanceable instrument for inquiry. The first production beta is forming now.",
      "narration": "How many times a day do you pick up your phone without deciding to? This is the opposite. A small round instrument you glance at, which tells you one thing and then lets you go. Everything else here grew out of it.",
      "priceDetail": "The 1.75C round instrument. Beta reservation $49, refundable or credited in full · members $153",
      "category": "devices",
      "maturity": "Sapling",
      "status": "beta",
      "availability": "Beta hardware available now",
      "offerKind": "hardware",
      "checkoutProductId": "astrolabe_beta",
      "facultySponsor": null,
      "pageUrl": "https://astrolabe.castalia.institute/",
      "offer": {
        "price": 219,
        "currency": "USD",
        "pricingNote": "$219",
        "notForSale": false
      },
      "variants": [
        {
          "title": "Instrument",
          "price": 219
        },
        {
          "title": "Beta reservation",
          "price": 49
        }
      ],
      "tags": [
        "category:devices",
        "orchard:sapling",
        "available-now"
      ]
    },
    {
      "id": "xdj",
      "title": "XDJ",
      "description": "A toddler-friendly interface for learning music and sound on the Pioneer XDJ-RX2: rhythm, cause and effect, and tactile play, without exposing a professional DJ workflow. A deck a small child can be handed.",
      "narration": "Have you watched a toddler find the one button that does something and press it four hundred times? This is a real DJ deck with a child's way in: rhythm, and cause and effect, without the professional machinery. We have not worked out how to talk to the deck yet. That part is honest.",
      "priceDetail": "The way in to the RX2 is not cracked yet, so there is nothing to price. Pricing waits on whether the bridge speaks USB or the network — the two need different hardware.",
      "category": "devices",
      "maturity": "Seedling",
      "status": "development",
      "availability": "Research — the RX2 integration is unsolved",
      "checkoutProductId": null,
      "facultySponsor": null,
      "pageUrl": "https://castaliainstitute.github.io/atelier/#project-xdj",
      "offer": {
        "price": 0,
        "currency": "USD",
        "pricingNote": "Not for sale",
        "notForSale": true
      },
      "variants": [
        {
          "title": "XDJ",
          "price": 0
        }
      ],
      "tags": [
        "category:devices",
        "orchard:seedling",
        "not-for-sale"
      ]
    },
    {
      "id": "halo",
      "title": "Halo",
      "description": "An Astrolabe ring on the Colmi R09: a quiet interface for observing body-temperature patterns, checking in with yourself, and offering consent-led support to a partner. It pairs with LunaSay.",
      "narration": "Have you ever known you were getting ill a day before any symptoms? Your body often knows first. This ring watches the slow drift of your temperature and shows you the pattern. If you choose, someone who loves you can see it too.",
      "priceDetail": "Pairs with LunaSay. A reflective wellness instrument, not a medical device — temperature observations are not diagnoses. Partner sharing is opt-in, revocable, and always secondary to the wearer’s own judgment · members $125",
      "category": "devices",
      "maturity": "Seedling",
      "status": "development",
      "availability": "Concept, developing in public",
      "checkoutProductId": null,
      "facultySponsor": null,
      "pageUrl": "https://halo.castalia.institute/",
      "offer": {
        "price": 179,
        "currency": "USD",
        "pricingNote": "$179",
        "notForSale": false
      },
      "variants": [
        {
          "title": "Halo",
          "price": 179
        }
      ],
      "tags": [
        "category:devices",
        "orchard:seedling"
      ]
    },
    {
      "id": "lunasay",
      "title": "LunaSay",
      "description": "A pocket astrolabe for the people you love, in two sizes: the 1.85B pocket instrument and a four-inch version. It pairs with the Halo ring, so what it tells you about the people you care for can be met with what your own body is doing.",
      "narration": "Who do you think of first thing in the morning? This is a small round thing for your pocket that keeps those few people close. Not a feed, not notifications. Just the handful who matter, and how they are doing.",
      "priceDetail": "Pocket 1.85B $229, four-inch $329 · members from $160 · pairs with the Halo ring",
      "category": "devices",
      "maturity": "Seedling",
      "status": "development",
      "availability": "Developing in public",
      "checkoutProductId": null,
      "facultySponsor": null,
      "pageUrl": "https://lunasay.castalia.institute/",
      "offer": {
        "price": 229,
        "currency": "USD",
        "pricingNote": "$229–329",
        "notForSale": false
      },
      "variants": [
        {
          "title": "Pocket 1.85B",
          "price": 229
        },
        {
          "title": "Four-inch",
          "price": 329
        }
      ],
      "tags": [
        "category:devices",
        "orchard:seedling"
      ]
    },
    {
      "id": "fortunai",
      "title": "Fortun.ai",
      "description": "Ask what wants to be known. A small instrument for fortune telling, reflection, and the question you are carrying — an Astrolabe that answers obliquely, and on purpose.",
      "narration": "When you are stuck, have you ever wished someone would just ask you the right question? This one does not give answers. It asks. And what you catch yourself hoping it will say is usually the answer.",
      "priceDetail": "The 1.75C instrument with the Fortun.ai face · members $153",
      "category": "devices",
      "maturity": "Seedling",
      "status": "development",
      "availability": "Developing in public",
      "checkoutProductId": null,
      "facultySponsor": null,
      "pageUrl": "https://fortun.ai/",
      "offer": {
        "price": 219,
        "currency": "USD",
        "pricingNote": "$219",
        "notForSale": false
      },
      "variants": [
        {
          "title": "Fortun.ai",
          "price": 219
        }
      ],
      "tags": [
        "category:devices",
        "orchard:seedling"
      ]
    },
    {
      "id": "maria",
      "title": "MARIA",
      "description": "MARIA is the figurine. Astrolabe is the device. Together they make a companion for attention, learning, and creation.",
      "narration": "Do you talk to yourself while you are working something out? Most of us do. MARIA is a small figure who sits on the shelf and listens. A face for the thing you are thinking with, so it is a companion rather than an app.",
      "priceDetail": "Beta $39 · members $104",
      "category": "devices",
      "maturity": "Seedling",
      "status": "development",
      "availability": "Developing in public",
      "checkoutProductId": null,
      "facultySponsor": null,
      "pageUrl": "https://maria.castalia.institute/",
      "offer": {
        "price": 149,
        "currency": "USD",
        "pricingNote": "$149",
        "notForSale": false
      },
      "variants": [
        {
          "title": "MARIA",
          "price": 149
        }
      ],
      "tags": [
        "category:devices",
        "orchard:seedling"
      ]
    },
    {
      "id": "mynah",
      "title": "Mynah",
      "description": "A private, ambient, voice-first companion for the home and pocket. Early units are being tested with a small circle.",
      "narration": "Would you say something private out loud in your own kitchen, if you were not sure who was listening? This is a small phone rebuilt to answer you without sending your voice anywhere. It is meant to hear you, and keep it here.",
      "priceDetail": "Sourced and provisioned: rooted, de-Googled, locked down and tested · members $314 · software alone, for a device you already own, $59",
      "category": "devices",
      "maturity": "Sapling",
      "status": "beta",